abstract,authors,chemicals,citation,doi,history,issn,issue,journal,keywords,mesh,pmc,pmid,publication_types,title,url,volume,volume_issue,xml,year,author_first,references,institution,language,issn_data
"BACKGROUND: Hospitals in sub-Saharan Africa are inundated with HIV-infected patients and tuberculosis (TB) is the commonest opportunistic infection in this sub-group. Up to one third of TB-HIV co-infected patients fail to produce a sputum sample (sputum scarce) and diagnosis is thus often delayed or missed. We investigated the sensitivity of urine-based methods (Xpert MTB/RIF, LAM strip test and LAM ELISA) in such patients.
METHODOLOGY/PRINCIPAL FINDINGS: 281 HIV-infected hospitalised patients with clinically suspected TB provided a spot urine sample. The reference standard was culture positivity for Mycobacterium tuberculosis on ≥1 sputum or extra-pulmonary sample. MTB/RIF was performed using 1 ml of both unprocessed and, when possible, concentrated urine. Each unconcentrated urine sample was also tested using the Clearview LAM ELISA and Alere LAM strip test. 42% (116/242) of patients had culture-proven TB. 18% (20/54) were sputum scarce. In sputum-scarce patients, the sensitivity of urine MTB/RIF and LAM ELISA was 40% (95%CI: 22-61) and 60% (95%CI: 39-78), respectively. Urine MTB/RIF specificity was 98% (95%CI: 95-100). Combined sensitivity of urine LAM ELISA and MTB/RIF was better than MTB/RIF alone [MTB/RIF and LAM: 70% (95%CI: 48-85) vs. MTB/RIF: 40% (95%CI: 22-61), p = 0.03]. Significant predictors of urine MTB/RIF positivity were CD4<50 cells/ml (p = 0.001), elevated protein-to-creatinine ratio (p<0.001) and LAM ELISA positivity (p<0.001). Urine centrifugation and pelleting significantly increased the sensitivity of MTB/RIF over unprocessed urine in paired samples [42% (95%CI: 26-58) vs. 8% (95%CI: 0-16), p<0.001]. Urine MTB/RIF-generated C(T) values correlated poorly with markers of bacillary burden (smear grade and time-to-positivity).
CONCLUSIONS/SIGNIFICANCE: This preliminary study indicates that urine-based MTB/RIF, alone or in combination with LAM antigen detection, may potentially aid the diagnosis of TB in HIV-infected patients with advanced immunosuppression when sputum-based diagnosis is not possible. Concentration of urine prior to MTB/RIF-testing significantly improves sensitivity.","['Peter JG', 'Theron G', 'Muchinga TE', 'Govender U', 'Dheda K']","{'D000942': {'substance_name': 'Antigens, Bacterial', 'registry_number': '0'}, 'D011934': {'substance_name': 'Reagent Strips', 'registry_number': '0'}, 'D012293': {'substance_name': 'Rifampin', 'registry_number': 'VJT6J7R4TR'}}","Peter JG, et al. The diagnostic accuracy of urine-based Xpert MTB/RIF in HIV-infected hospitalized patients who are smear-negative or sputum scarce. The diagnostic accuracy of urine-based Xpert MTB/RIF in HIV-infected hospitalized patients who are smear-negative or sputum scarce. 2012; 7:e39966. doi: 10.1371/journal.pone.0039966",10.1371/journal.pone.0039966,"{'received': datetime.datetime(2012, 3, 8, 0, 0), 'accepted': datetime.datetime(2012, 6, 5, 0, 0), 'entrez': datetime.datetime(2012, 7, 21, 0, 0), 'pubmed': datetime.datetime(2012, 7, 21, 0, 0), 'medline': datetime.datetime(2013, 3, 27, 0, 0), 'pmc-release': datetime.datetime(2012, 7, 9, 0, 0)}",1932-6203,7,PLoS One,[],"{'D017088': {'descriptor_name': 'AIDS-Related Opportunistic Infections', 'major_topic': False, 'qualifier_name': 'complications', 'qualifier_ui': 'Q000150'}, 'D000328': {'descriptor_name': 'Adult', 'major_topic': False, 'qualifier_name': None, 'qualifier_ui': None}, 'D000942': {'descriptor_name': 'Antigens, Bacterial', 'major_topic': False, 'qualifier_name': 'analysis', 'qualifier_ui': 'Q000032'}, 'D002498': {'descriptor_name': 'Centrifugation', 'major_topic': False, 'qualifier_name': None, 'qualifier_ui': None}, 'D024881': {'descriptor_name': 'Drug Resistance, Bacterial', 'major_topic': False, 'qualifier_name': None, 'qualifier_ui': None}, 'D004797': {'descriptor_name': 'Enzyme-Linked Immunosorbent Assay', 'major_topic': False, 'qualifier_name': None, 'qualifier_ui': None}, 'D005240': {'descriptor_name': 'Feasibility Studies', 'major_topic': False, 'qualifier_name': None, 'qualifier_ui': None}, 'D015658': {'descriptor_name': 'HIV Infections', 'major_topic': False, 'qualifier_name': 'complications', 'qualifier_ui': 'Q000150'}, 'D006760': {'descriptor_name': 'Hospitalization', 'major_topic': False, 'qualifier_name': 'statistics & numerical data', 'qualifier_ui': 'Q000706'}, 'D006801': {'descriptor_name': 'Humans', 'major_topic': False, 'qualifier_name': None, 'qualifier_ui': None}, 'D008297': {'descriptor_name': 'Male', 'major_topic': False, 'qualifier_name': None, 'qualifier_ui': None}, 'D009169': {'descriptor_name': 'Mycobacterium tuberculosis', 'major_topic': False, 'qualifier_name': 'drug effects', 'qualifier_ui': 'Q000187'}, 'D011934': {'descriptor_name': 'Reagent Strips', 'major_topic': False, 'qualifier_name': 'metabolism', 'qualifier_ui': 'Q000378'}, 'D012293': {'descriptor_name': 'Rifampin', 'major_topic': False, 'qualifier_name': 'pharmacology', 'qualifier_ui': 'Q000494'}, 'D012680': {'descriptor_name': 'Sensitivity and Specificity', 'major_topic': False, 'qualifier_name': None, 'qualifier_ui': None}, 'D013183': {'descriptor_name': 'Sputum', 'major_topic': False, 'qualifier_name': 'microbiology', 'qualifier_ui': 'Q000382'}, 'D014376': {'descriptor_name': 'Tuberculosis', 'major_topic': False, 'qualifier_name': 'complications', 'qualifier_ui': 'Q000150'}, 'D016482': {'descriptor_name': 'Urinalysis', 'major_topic': False, 'qualifier_name': 'instrumentation', 'qualifier_ui': 'Q000295'}}",3392260,22815718,"{'D016430': 'Clinical Trial', 'D016428': 'Journal Article', 'D013485': ""Research Support, Non-U.S. Gov't""}",The diagnostic accuracy of urine-based Xpert MTB/RIF in HIV-infected hospitalized patients who are smear-negative or sputum scarce.,https://ncbi.nlm.nih.gov/pubmed/22815718,7,7(7),"<?xml version=""1.0"" ?>
<!DOCTYPE PubmedArticleSet PUBLIC ""-//NLM//DTD PubMedArticle, 1st January 2025//EN"" ""https://dtd.nlm.nih.gov/ncbi/pubmed/out/pubmed_250101.dtd"">
<PubmedArticleSet>
<PubmedArticle><MedlineCitation Status=""MEDLINE"" Owner=""NLM"" IndexingMethod=""Manual""><PMID Version=""1"">22815718</PMID><DateCompleted><Year>2013</Year><Month>03</Month><Day>26</Day></DateCompleted><DateRevised><Year>2024</Year><Month>03</Month><Day>17</Day></DateRevised><Article PubModel=""Print-Electronic""><Journal><ISSN IssnType=""Electronic"">1932-6203</ISSN><JournalIssue CitedMedium=""Internet""><Volume>7</Volume><Issue>7</Issue><PubDate><Year>2012</Year></PubDate></JournalIssue><Title>PloS one</Title><ISOAbbreviation>PLoS One</ISOAbbreviation></Journal><ArticleTitle>The diagnostic accuracy of urine-based Xpert MTB/RIF in HIV-infected hospitalized patients who are smear-negative or sputum scarce.</ArticleTitle><Pagination><StartPage>e39966</StartPage><MedlinePgn>e39966</MedlinePgn></Pagination><ELocationID EIdType=""pii"" ValidYN=""Y"">e39966</ELocationID><ELocationID EIdType=""doi"" ValidYN=""Y"">10.1371/journal.pone.0039966</ELocationID><Abstract><AbstractText Label=""BACKGROUND"" NlmCategory=""BACKGROUND"">Hospitals in sub-Saharan Africa are inundated with HIV-infected patients and tuberculosis (TB) is the commonest opportunistic infection in this sub-group. Up to one third of TB-HIV co-infected patients fail to produce a sputum sample (sputum scarce) and diagnosis is thus often delayed or missed. We investigated the sensitivity of urine-based methods (Xpert MTB/RIF, LAM strip test and LAM ELISA) in such patients.</AbstractText><AbstractText Label=""METHODOLOGY/PRINCIPAL FINDINGS"" NlmCategory=""RESULTS"">281 HIV-infected hospitalised patients with clinically suspected TB provided a spot urine sample. The reference standard was culture positivity for Mycobacterium tuberculosis on &#x2265;1 sputum or extra-pulmonary sample. MTB/RIF was performed using 1 ml of both unprocessed and, when possible, concentrated urine. Each unconcentrated urine sample was also tested using the Clearview LAM ELISA and Alere LAM strip test. 42% (116/242) of patients had culture-proven TB. 18% (20/54) were sputum scarce. In sputum-scarce patients, the sensitivity of urine MTB/RIF and LAM ELISA was 40% (95%CI: 22-61) and 60% (95%CI: 39-78), respectively. Urine MTB/RIF specificity was 98% (95%CI: 95-100). Combined sensitivity of urine LAM ELISA and MTB/RIF was better than MTB/RIF alone [MTB/RIF and LAM: 70% (95%CI: 48-85) vs. MTB/RIF: 40% (95%CI: 22-61), p&#x200a;=&#x200a;0.03]. Significant predictors of urine MTB/RIF positivity were CD4&lt;50 cells/ml (p&#x200a;=&#x200a;0.001), elevated protein-to-creatinine ratio (p&lt;0.001) and LAM ELISA positivity (p&lt;0.001). Urine centrifugation and pelleting significantly increased the sensitivity of MTB/RIF over unprocessed urine in paired samples [42% (95%CI: 26-58) vs. 8% (95%CI: 0-16), p&lt;0.001]. Urine MTB/RIF-generated C(T) values correlated poorly with markers of bacillary burden (smear grade and time-to-positivity).</AbstractText><AbstractText Label=""CONCLUSIONS/SIGNIFICANCE"" NlmCategory=""CONCLUSIONS"">This preliminary study indicates that urine-based MTB/RIF, alone or in combination with LAM antigen detection, may potentially aid the diagnosis of TB in HIV-infected patients with advanced immunosuppression when sputum-based diagnosis is not possible. Concentration of urine prior to MTB/RIF-testing significantly improves sensitivity.</AbstractText></Abstract><AuthorList CompleteYN=""Y""><Author ValidYN=""Y""><LastName>Peter</LastName><ForeName>Jonathan G</ForeName><Initials>JG</Initials><AffiliationInfo><Affiliation>Lung Infection and Immunity Unit, Division of Pulmonology &amp; UCT Lung Institute, Department of Medicine, University of Cape Town, Cape Town, South Africa.</Affiliation></AffiliationInfo></Author><Author ValidYN=""Y""><LastName>Theron</LastName><ForeName>Grant</ForeName><Initials>G</Initials></Author><Author ValidYN=""Y""><LastName>Muchinga</LastName><ForeName>Tapuwa E</ForeName><Initials>TE</Initials></Author><Author ValidYN=""Y""><LastName>Govender</LastName><ForeName>Ureshnie</ForeName><Initials>U</Initials></Author><Author ValidYN=""Y""><LastName>Dheda</LastName><ForeName>Keertan</ForeName><Initials>K</Initials></Author></AuthorList><Language>eng</Language><PublicationTypeList><PublicationType UI=""D016430"">Clinical Trial</PublicationType><PublicationType UI=""D016428"">Journal Article</PublicationType><PublicationType UI=""D013485"">Research Support, Non-U.S. Gov't</PublicationType></PublicationTypeList><ArticleDate DateType=""Electronic""><Year>2012</Year><Month>07</Month><Day>09</Day></ArticleDate></Article><MedlineJournalInfo><Country>United States</Country><MedlineTA>PLoS One</MedlineTA><NlmUniqueID>101285081</NlmUniqueID><ISSNLinking>1932-6203</ISSNLinking></MedlineJournalInfo><ChemicalList><Chemical><RegistryNumber>0</RegistryNumber><NameOfSubstance UI=""D000942"">Antigens, Bacterial</NameOfSubstance></Chemical><Chemical><RegistryNumber>0</RegistryNumber><NameOfSubstance UI=""D011934"">Reagent Strips</NameOfSubstance></Chemical><Chemical><RegistryNumber>VJT6J7R4TR</RegistryNumber><NameOfSubstance UI=""D012293"">Rifampin</NameOfSubstance></Chemical></ChemicalList><CitationSubset>IM</CitationSubset><MeshHeadingList><MeshHeading><DescriptorName UI=""D017088"" MajorTopicYN=""N"">AIDS-Related Opportunistic Infections</DescriptorName><QualifierName UI=""Q000150"" MajorTopicYN=""N"">complications</QualifierName><QualifierName UI=""Q000175"" MajorTopicYN=""N"">diagnosis</QualifierName><QualifierName UI=""Q000652"" MajorTopicYN=""N"">urine</QualifierName></MeshHeading><MeshHeading><DescriptorName UI=""D000328"" MajorTopicYN=""N"">Adult</DescriptorName></MeshHeading><MeshHeading><DescriptorName UI=""D000942"" MajorTopicYN=""N"">Antigens, Bacterial</DescriptorName><QualifierName UI=""Q000032"" MajorTopicYN=""N"">analysis</QualifierName><QualifierName UI=""Q000276"" MajorTopicYN=""N"">immunology</QualifierName></MeshHeading><MeshHeading><DescriptorName UI=""D002498"" MajorTopicYN=""N"">Centrifugation</DescriptorName></MeshHeading><MeshHeading><DescriptorName UI=""D024881"" MajorTopicYN=""N"">Drug Resistance, Bacterial</DescriptorName></MeshHeading><MeshHeading><DescriptorName UI=""D004797"" MajorTopicYN=""N"">Enzyme-Linked Immunosorbent Assay</DescriptorName></MeshHeading><MeshHeading><DescriptorName UI=""D005240"" MajorTopicYN=""N"">Feasibility Studies</DescriptorName></MeshHeading><MeshHeading><DescriptorName UI=""D015658"" MajorTopicYN=""N"">HIV Infections</DescriptorName><QualifierName UI=""Q000150"" MajorTopicYN=""Y"">complications</QualifierName></MeshHeading><MeshHeading><DescriptorName UI=""D006760"" MajorTopicYN=""N"">Hospitalization</DescriptorName><QualifierName UI=""Q000706"" MajorTopicYN=""Y"">statistics &amp; numerical data</QualifierName></MeshHeading><MeshHeading><DescriptorName UI=""D006801"" MajorTopicYN=""N"">Humans</DescriptorName></MeshHeading><MeshHeading><DescriptorName UI=""D008297"" MajorTopicYN=""N"">Male</DescriptorName></MeshHeading><MeshHeading><DescriptorName UI=""D009169"" MajorTopicYN=""N"">Mycobacterium tuberculosis</DescriptorName><QualifierName UI=""Q000187"" MajorTopicYN=""N"">drug effects</QualifierName><QualifierName UI=""Q000276"" MajorTopicYN=""N"">immunology</QualifierName><QualifierName UI=""Q000302"" MajorTopicYN=""N"">isolation &amp; purification</QualifierName><QualifierName UI=""Q000502"" MajorTopicYN=""Y"">physiology</QualifierName></MeshHeading><MeshHeading><DescriptorName UI=""D011934"" MajorTopicYN=""N"">Reagent Strips</DescriptorName><QualifierName UI=""Q000378"" MajorTopicYN=""N"">metabolism</QualifierName></MeshHeading><MeshHeading><DescriptorName UI=""D012293"" MajorTopicYN=""N"">Rifampin</DescriptorName><QualifierName UI=""Q000494"" MajorTopicYN=""Y"">pharmacology</QualifierName></MeshHeading><MeshHeading><DescriptorName UI=""D012680"" MajorTopicYN=""N"">Sensitivity and Specificity</DescriptorName></MeshHeading><MeshHeading><DescriptorName UI=""D013183"" MajorTopicYN=""N"">Sputum</DescriptorName><QualifierName UI=""Q000382"" MajorTopicYN=""Y"">microbiology</QualifierName></MeshHeading><MeshHeading><DescriptorName UI=""D014376"" MajorTopicYN=""N"">Tuberculosis</DescriptorName><QualifierName UI=""Q000150"" MajorTopicYN=""N"">complications</QualifierName><QualifierName UI=""Q000175"" MajorTopicYN=""Y"">diagnosis</QualifierName><QualifierName UI=""Q000652"" MajorTopicYN=""N"">urine</QualifierName></MeshHeading><MeshHeading><DescriptorName UI=""D016482"" MajorTopicYN=""N"">Urinalysis</DescriptorName><QualifierName UI=""Q000295"" MajorTopicYN=""N"">instrumentation</QualifierName><QualifierName UI=""Q000379"" MajorTopicYN=""Y"">methods</QualifierName></MeshHeading></MeshHeadingList><CoiStatement><b>Competing Interests: </b>Keertan Dheda is a Plos ONE editorial board member. This does not alter our adherence to all the PLoS ONE policies on sharing data and materials.</CoiStatement></MedlineCitation><PubmedData><History><PubMedPubDate PubStatus=""received""><Year>2012</Year><Month>3</Month><Day>8</Day></PubMedPubDate><PubMedPubDate PubStatus=""accepted""><Year>2012</Year><Month>6</Month><Day>5</Day></PubMedPubDate><PubMedPubDate PubStatus=""entrez""><Year>2012</Year><Month>7</Month><Day>21</Day><Hour>6</Hour><Minute>0</Minute></PubMedPubDate><PubMedPubDate PubStatus=""pubmed""><Year>2012</Year><Month>7</Month><Day>21</Day><Hour>6</Hour><Minute>0</Minute></PubMedPubDate><PubMedPubDate PubStatus=""medline""><Year>2013</Year><Month>3</Month><Day>27</Day><Hour>6</Hour><Minute>0</Minute></PubMedPubDate><PubMedPubDate PubStatus=""pmc-release""><Year>2012</Year><Month>7</Month><Day>9</Day></PubMedPubDate></History><PublicationStatus>ppublish</PublicationStatus><ArticleIdList><ArticleId IdType=""pubmed"">22815718</ArticleId><ArticleId IdType=""pmc"">PMC3392260</ArticleId><ArticleId IdType=""doi"">10.1371/journal.pone.0039966</ArticleId><ArticleId IdType=""pii"">PONE-D-12-07226</ArticleId></ArticleIdList><ReferenceList><Reference><Citation>WHO. WHO Report 2011: Global tuberculosis control. Geneva: World Heath Organisation. ISBN 978 92 4 156438 0 ISBN 978 92 4 156438 0. 2011.</Citation></Reference><Reference><Citation>Reid MJ, Shah NS. Approaches to tuberculosis screening and diagnosis in people with HIV in resource-limited settings. Lancet Infect Dis. 2009;9:173&#x2013;184.</Citation><ArticleIdList><ArticleId IdType=""pubmed"">19246021</ArticleId></ArticleIdList></Reference><Reference><Citation>Jones BE, Young SM, Antoniskis D, Davidson PT, Kramer F, et al. Relationship of the manifestations of tuberculosis to CD4 cell counts in patients with human immunodeficiency virus infection. The American review of respiratory disease. 1993;148:1292&#x2013;1297.</Citation><ArticleIdList><ArticleId IdType=""pubmed"">7902049</ArticleId></ArticleIdList></Reference><Reference><Citation>Peter JG, Theron G, van Zyl-Smit R, Haripersad A, Mottay L, et al. Diagnostic accuracy of a urine LAM strip-test for TB detection in HIV-infected hospitalised patients. The European respiratory journal : official journal of the European Society for Clinical Respiratory Physiology. 2012.</Citation><ArticleIdList><ArticleId IdType=""pmc"">PMC5523653</ArticleId><ArticleId IdType=""pubmed"">22362849</ArticleId></ArticleIdList></Reference><Reference><Citation>Cox JA, Lukande RL, Lucas S, Nelson AM, Van Marck E, et al. Autopsy causes of death in HIV-positive individuals in sub-Saharan Africa and correlation with clinical diagnoses. AIDS Rev. 2010;12:183&#x2013;194.</Citation><ArticleIdList><ArticleId IdType=""pubmed"">21179183</ArticleId></ArticleIdList></Reference><Reference><Citation>Rana FS, Hawken MP, Mwachari C, Bhatt SM, Abdullah F, et al. Autopsy study of HIV-1-positive and HIV-1-negative adult medical patients in Nairobi, Kenya. J Acquir Immune Defic Syndr. 2000;24:23&#x2013;29.</Citation><ArticleIdList><ArticleId IdType=""pubmed"">10877491</ArticleId></ArticleIdList></Reference><Reference><Citation>Cohen T, Murray M, Wallengren K, Alvarez GG, Samuel EY, et al. The prevalence and drug sensitivity of tuberculosis among patients dying in hospital in KwaZulu-Natal, South Africa: a postmortem study. PLoS Med. 2010;7:e1000296.</Citation><ArticleIdList><ArticleId IdType=""pmc"">PMC2889914</ArticleId><ArticleId IdType=""pubmed"">20582324</ArticleId></ArticleIdList></Reference><Reference><Citation>Holtz TH, Kabera G, Mthiyane T, Zingoni T, Nadesan S, et al. Use of a WHO-recommended algorithm to reduce mortality in seriously ill patients with HIV infection and smear-negative pulmonary tuberculosis in South Africa: an observational cohort study. The Lancet infectious diseases. 2011;11:533&#x2013;540.</Citation><ArticleIdList><ArticleId IdType=""pubmed"">21514234</ArticleId></ArticleIdList></Reference><Reference><Citation>Peter J, Green C, Hoelscher M, Mwaba P, Zumla A, et al. Urine for the diagnosis of tuberculosis: current approaches, clinical applicability, and new developments. Curr Opin Pulm Med. 2010;16:262&#x2013;270.</Citation><ArticleIdList><ArticleId IdType=""pmc"">PMC5454484</ArticleId><ArticleId IdType=""pubmed"">20375787</ArticleId></ArticleIdList></Reference><Reference><Citation>WHO. Roadmap for Rolling Out Xpert MTB/RIF for Rapid Diagnosis of TB and MDR-TB World Health Organization, Geneva, Switzerland. 2010.</Citation></Reference><Reference><Citation>WHO. Rapid Implementation of the Xpert MTB/RIF diagnostic test. Publication number WHO/HTM/TB/2011.2. World Health Organization, Geneva, Switzerland. 2011.</Citation></Reference><Reference><Citation>Boehme CC, Nicol MP, Nabeta P, Michael JS, Gotuzzo E, et al. Feasibility, diagnostic accuracy, and effectiveness of decentralised use of the Xpert MTB/RIF test for diagnosis of tuberculosis and multidrug resistance: a multicentre implementation study. Lancet. 2011;377:1495&#x2013;1505.</Citation><ArticleIdList><ArticleId IdType=""pmc"">PMC3085933</ArticleId><ArticleId IdType=""pubmed"">21507477</ArticleId></ArticleIdList></Reference><Reference><Citation>Flores LL, Steingart KR, Dendukuri N, Schiller I, Minion J, et al. Systematic review and meta-analysis of antigen detection tests for the diagnosis of tuberculosis. Clinical and vaccine immunology : CVI. 2011;18:1616&#x2013;1627.</Citation><ArticleIdList><ArticleId IdType=""pmc"">PMC3187027</ArticleId><ArticleId IdType=""pubmed"">21832100</ArticleId></ArticleIdList></Reference><Reference><Citation>Dheda K, Van-Zyl Smit RN, Sechi LA, Badri M, Meldau R, et al. Clinical diagnostic utility of IP-10 and LAM antigen levels for the diagnosis of tuberculous pleural effusions in a high burden setting. PLoS One. 2009;4:e4689.</Citation><ArticleIdList><ArticleId IdType=""pmc"">PMC2650091</ArticleId><ArticleId IdType=""pubmed"">19277111</ArticleId></ArticleIdList></Reference><Reference><Citation>Theron G, Peter J, van Zyl-Smit R, Mishra H, Streicher E, et al. Evaluation of the Xpert MTB/RIF assay for the diagnosis of pulmonary tuberculosis in a high HIV prevalence setting. American journal of respiratory and critical care medicine. 2011;184:132&#x2013;140.</Citation><ArticleIdList><ArticleId IdType=""pubmed"">21493734</ArticleId></ArticleIdList></Reference><Reference><Citation>Bossuyt PM, Reitsma JB, Bruns DE, Gatsonis CA, Glasziou PP, et al. The STARD statement for reporting studies of diagnostic accuracy: explanation and elaboration. The Standards for Reporting of Diagnostic Accuracy Group. Croat Med J. 2003;44:639&#x2013;650.</Citation><ArticleIdList><ArticleId IdType=""pubmed"">14515429</ArticleId></ArticleIdList></Reference><Reference><Citation>Gonzalez-Angulo Y, Wiysonge CS, Geldenhuys H, Hanekom W, Mahomed H, et al. Sputum induction for the diagnosis of pulmonary tuberculosis: a systematic review and meta-analysis. European journal of clinical microbiology &amp; infectious diseases : official publication of the European Society of Clinical Microbiology. 2011.</Citation><ArticleIdList><ArticleId IdType=""pubmed"">22095153</ArticleId></ArticleIdList></Reference><Reference><Citation>Lawn SD, Brooks SV, Kranzer K, Nicol MP, Whitelaw A, et al. Screening for HIV-associated tuberculosis and rifampicin resistance before antiretroviral therapy using the Xpert MTB/RIF assay: a prospective study. PLoS Med. 2011;8:e1001067.</Citation><ArticleIdList><ArticleId IdType=""pmc"">PMC3144215</ArticleId><ArticleId IdType=""pubmed"">21818180</ArticleId></ArticleIdList></Reference><Reference><Citation>Minion J, Leung E, Talbot E, Dheda K, Pai M, et al. Diagnosing tuberculosis with urine lipoarabinomannan: systematic review and meta-analysis. The European respiratory journal : official journal of the European Society for Clinical Respiratory Physiology. 2011;38:1398&#x2013;1405.</Citation><ArticleIdList><ArticleId IdType=""pubmed"">21700601</ArticleId></ArticleIdList></Reference><Reference><Citation>Shah M, Variava E, Holmes CB, Coppin A, Golub JE, et al. Diagnostic accuracy of a urine lipoarabinomannan test for tuberculosis in hospitalized patients in a High HIV prevalence setting. Journal of acquired immune deficiency syndromes. 2009;52:145&#x2013;151.</Citation><ArticleIdList><ArticleId IdType=""pmc"">PMC2815254</ArticleId><ArticleId IdType=""pubmed"">19692904</ArticleId></ArticleIdList></Reference><Reference><Citation>Lawn SD, Kerkhoff AD, Vogt M, Wood R. Diagnostic accuracy of a low-cost, urine antigen, point-of-care screening assay for HIV-associated pulmonary tuberculosis before antiretroviral therapy: a descriptive study. Lancet Infect Dis. 2011.</Citation><ArticleIdList><ArticleId IdType=""pmc"">PMC3315025</ArticleId><ArticleId IdType=""pubmed"">22015305</ArticleId></ArticleIdList></Reference><Reference><Citation>Theron G, Pooran A, Peter J, van Zyl-Smit R, Mishra HK, et al. Do adjunct TB tests, when combined with Xpert MTB/RIF, improve accuracy and the cost of diagnosis in a resource-poor setting? The European respiratory journal : official journal of the European Society for Clinical Respiratory Physiology. 2011.</Citation><ArticleIdList><ArticleId IdType=""pubmed"">0</ArticleId></ArticleIdList></Reference><Reference><Citation>Hillemann D, Rusch-Gerdes S, Boehme C, Richter E. Rapid molecular detection of extrapulmonary tuberculosis by the automated GeneXpert MTB/RIF system. J Clin Microbiol. 2011;49:1202&#x2013;1205.</Citation><ArticleIdList><ArticleId IdType=""pmc"">PMC3122824</ArticleId><ArticleId IdType=""pubmed"">21270230</ArticleId></ArticleIdList></Reference><Reference><Citation>Lawn SD, Kerkhoff AD, Vogt M, Wood R. High diagnostic yield of tuberculosis from screening urine samples from HIV-infected patients with advanced immunodeficiency using the Xpert MTB/RIF assay. Journal of Acquired Immune Deficiency Syndromes. 2012.</Citation><ArticleIdList><ArticleId IdType=""pmc"">PMC3384719</ArticleId><ArticleId IdType=""pubmed"">22531759</ArticleId></ArticleIdList></Reference><Reference><Citation>Stewart SM. The bacteriological diagnosis of tuberculous meningitis. Journal of clinical pathology. 1953;6:241&#x2013;242.</Citation><ArticleIdList><ArticleId IdType=""pmc"">PMC1023629</ArticleId><ArticleId IdType=""pubmed"">13084774</ArticleId></ArticleIdList></Reference><Reference><Citation>Blakemore R, Nabeta P, Davidow AL, Vadwai V, Tahirli R, et al. A multisite assessment of the quantitative capabilities of the Xpert MTB/RIF assay. American journal of respiratory and critical care medicine. 2011;184:1076&#x2013;1084.</Citation><ArticleIdList><ArticleId IdType=""pmc"">PMC3208646</ArticleId><ArticleId IdType=""pubmed"">21836139</ArticleId></ArticleIdList></Reference><Reference><Citation>Theron G, Pinto L, Peter J, Mishra HK, van Zyl-Smit R, et al. The use of an automated quantitative polymerase chain reaction (Xpert MTB/RIF) to predict the sputum smear status of tuberculosis patients. Clinical infectious diseases : an official publication of the Infectious Diseases Society of America. 2012;54:384&#x2013;388.</Citation><ArticleIdList><ArticleId IdType=""pmc"">PMC3258275</ArticleId><ArticleId IdType=""pubmed"">22139854</ArticleId></ArticleIdList></Reference><Reference><Citation>Moure R, Munoz L, Torres M, Santin M, Martin R, et al. Rapid detection of Mycobacterium tuberculosis complex and rifampin resistance in smear-negative clinical samples by use of an integrated real-time PCR method. J Clin Microbiol. 2011;49:1137&#x2013;1139.</Citation><ArticleIdList><ArticleId IdType=""pmc"">PMC3067676</ArticleId><ArticleId IdType=""pubmed"">21191053</ArticleId></ArticleIdList></Reference></ReferenceList></PubmedData></PubmedArticle></PubmedArticleSet>",2012,Peter JG,"[{""citation"": ""WHO. WHO Report 2011: Global tuberculosis control. Geneva: World Heath Organisation. ISBN 978 92 4 156438 0 ISBN 978 92 4 156438 0. 2011."", ""article_ids"": {}}, {""citation"": ""Reid MJ, Shah NS. Approaches to tuberculosis screening and diagnosis in people with HIV in resource-limited settings. Lancet Infect Dis. 2009;9:173\u2013184."", ""article_ids"": {""pubmed"": ""19246021""}}, {""citation"": ""Jones BE, Young SM, Antoniskis D, Davidson PT, Kramer F, et al. Relationship of the manifestations of tuberculosis to CD4 cell counts in patients with human immunodeficiency virus infection. The American review of respiratory disease. 1993;148:1292\u20131297."", ""article_ids"": {""pubmed"": ""7902049""}}, {""citation"": ""Peter JG, Theron G, van Zyl-Smit R, Haripersad A, Mottay L, et al. Diagnostic accuracy of a urine LAM strip-test for TB detection in HIV-infected hospitalised patients. The European respiratory journal : official journal of the European Society for Clinical Respiratory Physiology. 2012."", ""article_ids"": {""pmc"": ""PMC5523653"", ""pubmed"": ""22362849""}}, {""citation"": ""Cox JA, Lukande RL, Lucas S, Nelson AM, Van Marck E, et al. Autopsy causes of death in HIV-positive individuals in sub-Saharan Africa and correlation with clinical diagnoses. AIDS Rev. 2010;12:183\u2013194."", ""article_ids"": {""pubmed"": ""21179183""}}, {""citation"": ""Rana FS, Hawken MP, Mwachari C, Bhatt SM, Abdullah F, et al. Autopsy study of HIV-1-positive and HIV-1-negative adult medical patients in Nairobi, Kenya. J Acquir Immune Defic Syndr. 2000;24:23\u201329."", ""article_ids"": {""pubmed"": ""10877491""}}, {""citation"": ""Cohen T, Murray M, Wallengren K, Alvarez GG, Samuel EY, et al. The prevalence and drug sensitivity of tuberculosis among patients dying in hospital in KwaZulu-Natal, South Africa: a postmortem study. PLoS Med. 2010;7:e1000296."", ""article_ids"": {""pmc"": ""PMC2889914"", ""pubmed"": ""20582324""}}, {""citation"": ""Holtz TH, Kabera G, Mthiyane T, Zingoni T, Nadesan S, et al. Use of a WHO-recommended algorithm to reduce mortality in seriously ill patients with HIV infection and smear-negative pulmonary tuberculosis in South Africa: an observational cohort study. The Lancet infectious diseases. 2011;11:533\u2013540."", ""article_ids"": {""pubmed"": ""21514234""}}, {""citation"": ""Peter J, Green C, Hoelscher M, Mwaba P, Zumla A, et al. Urine for the diagnosis of tuberculosis: current approaches, clinical applicability, and new developments. Curr Opin Pulm Med. 2010;16:262\u2013270."", ""article_ids"": {""pmc"": ""PMC5454484"", ""pubmed"": ""20375787""}}, {""citation"": ""WHO. Roadmap for Rolling Out Xpert MTB/RIF for Rapid Diagnosis of TB and MDR-TB World Health Organization, Geneva, Switzerland. 2010."", ""article_ids"": {}}, {""citation"": ""WHO. Rapid Implementation of the Xpert MTB/RIF diagnostic test. Publication number WHO/HTM/TB/2011.2. World Health Organization, Geneva, Switzerland. 2011."", ""article_ids"": {}}, {""citation"": ""Boehme CC, Nicol MP, Nabeta P, Michael JS, Gotuzzo E, et al. Feasibility, diagnostic accuracy, and effectiveness of decentralised use of the Xpert MTB/RIF test for diagnosis of tuberculosis and multidrug resistance: a multicentre implementation study. Lancet. 2011;377:1495\u20131505."", ""article_ids"": {""pmc"": ""PMC3085933"", ""pubmed"": ""21507477""}}, {""citation"": ""Flores LL, Steingart KR, Dendukuri N, Schiller I, Minion J, et al. Systematic review and meta-analysis of antigen detection tests for the diagnosis of tuberculosis. Clinical and vaccine immunology : CVI. 2011;18:1616\u20131627."", ""article_ids"": {""pmc"": ""PMC3187027"", ""pubmed"": ""21832100""}}, {""citation"": ""Dheda K, Van-Zyl Smit RN, Sechi LA, Badri M, Meldau R, et al. Clinical diagnostic utility of IP-10 and LAM antigen levels for the diagnosis of tuberculous pleural effusions in a high burden setting. PLoS One. 2009;4:e4689."", ""article_ids"": {""pmc"": ""PMC2650091"", ""pubmed"": ""19277111""}}, {""citation"": ""Theron G, Peter J, van Zyl-Smit R, Mishra H, Streicher E, et al. Evaluation of the Xpert MTB/RIF assay for the diagnosis of pulmonary tuberculosis in a high HIV prevalence setting. American journal of respiratory and critical care medicine. 2011;184:132\u2013140."", ""article_ids"": {""pubmed"": ""21493734""}}, {""citation"": ""Bossuyt PM, Reitsma JB, Bruns DE, Gatsonis CA, Glasziou PP, et al. The STARD statement for reporting studies of diagnostic accuracy: explanation and elaboration. The Standards for Reporting of Diagnostic Accuracy Group. Croat Med J. 2003;44:639\u2013650."", ""article_ids"": {""pubmed"": ""14515429""}}, {""citation"": ""Gonzalez-Angulo Y, Wiysonge CS, Geldenhuys H, Hanekom W, Mahomed H, et al. Sputum induction for the diagnosis of pulmonary tuberculosis: a systematic review and meta-analysis. European journal of clinical microbiology & infectious diseases : official publication of the European Society of Clinical Microbiology. 2011."", ""article_ids"": {""pubmed"": ""22095153""}}, {""citation"": ""Lawn SD, Brooks SV, Kranzer K, Nicol MP, Whitelaw A, et al. Screening for HIV-associated tuberculosis and rifampicin resistance before antiretroviral therapy using the Xpert MTB/RIF assay: a prospective study. PLoS Med. 2011;8:e1001067."", ""article_ids"": {""pmc"": ""PMC3144215"", ""pubmed"": ""21818180""}}, {""citation"": ""Minion J, Leung E, Talbot E, Dheda K, Pai M, et al. Diagnosing tuberculosis with urine lipoarabinomannan: systematic review and meta-analysis. The European respiratory journal : official journal of the European Society for Clinical Respiratory Physiology. 2011;38:1398\u20131405."", ""article_ids"": {""pubmed"": ""21700601""}}, {""citation"": ""Shah M, Variava E, Holmes CB, Coppin A, Golub JE, et al. Diagnostic accuracy of a urine lipoarabinomannan test for tuberculosis in hospitalized patients in a High HIV prevalence setting. Journal of acquired immune deficiency syndromes. 2009;52:145\u2013151."", ""article_ids"": {""pmc"": ""PMC2815254"", ""pubmed"": ""19692904""}}, {""citation"": ""Lawn SD, Kerkhoff AD, Vogt M, Wood R. Diagnostic accuracy of a low-cost, urine antigen, point-of-care screening assay for HIV-associated pulmonary tuberculosis before antiretroviral therapy: a descriptive study. Lancet Infect Dis. 2011."", ""article_ids"": {""pmc"": ""PMC3315025"", ""pubmed"": ""22015305""}}, {""citation"": ""Theron G, Pooran A, Peter J, van Zyl-Smit R, Mishra HK, et al. Do adjunct TB tests, when combined with Xpert MTB/RIF, improve accuracy and the cost of diagnosis in a resource-poor setting? The European respiratory journal : official journal of the European Society for Clinical Respiratory Physiology. 2011."", ""article_ids"": {""pubmed"": ""0""}}, {""citation"": ""Hillemann D, Rusch-Gerdes S, Boehme C, Richter E. Rapid molecular detection of extrapulmonary tuberculosis by the automated GeneXpert MTB/RIF system. J Clin Microbiol. 2011;49:1202\u20131205."", ""article_ids"": {""pmc"": ""PMC3122824"", ""pubmed"": ""21270230""}}, {""citation"": ""Lawn SD, Kerkhoff AD, Vogt M, Wood R. High diagnostic yield of tuberculosis from screening urine samples from HIV-infected patients with advanced immunodeficiency using the Xpert MTB/RIF assay. Journal of Acquired Immune Deficiency Syndromes. 2012."", ""article_ids"": {""pmc"": ""PMC3384719"", ""pubmed"": ""22531759""}}, {""citation"": ""Stewart SM. The bacteriological diagnosis of tuberculous meningitis. Journal of clinical pathology. 1953;6:241\u2013242."", ""article_ids"": {""pmc"": ""PMC1023629"", ""pubmed"": ""13084774""}}, {""citation"": ""Blakemore R, Nabeta P, Davidow AL, Vadwai V, Tahirli R, et al. A multisite assessment of the quantitative capabilities of the Xpert MTB/RIF assay. American journal of respiratory and critical care medicine. 2011;184:1076\u20131084."", ""article_ids"": {""pmc"": ""PMC3208646"", ""pubmed"": ""21836139""}}, {""citation"": ""Theron G, Pinto L, Peter J, Mishra HK, van Zyl-Smit R, et al. The use of an automated quantitative polymerase chain reaction (Xpert MTB/RIF) to predict the sputum smear status of tuberculosis patients. Clinical infectious diseases : an official publication of the Infectious Diseases Society of America. 2012;54:384\u2013388."", ""article_ids"": {""pmc"": ""PMC3258275"", ""pubmed"": ""22139854""}}, {""citation"": ""Moure R, Munoz L, Torres M, Santin M, Martin R, et al. Rapid detection of Mycobacterium tuberculosis complex and rifampin resistance in smear-negative clinical samples by use of an integrated real-time PCR method. J Clin Microbiol. 2011;49:1137\u20131139."", ""article_ids"": {""pmc"": ""PMC3067676"", ""pubmed"": ""21191053""}}]","Lung Infection and Immunity Unit, Division of Pulmonology & UCT Lung Institute, Department of Medicine, University of Cape Town, Cape Town, South Africa.",English,"{""title proper"": ""plos one."", ""other variant title"": [""plos 1"", ""plos one"", ""public library of science one""], ""original alphabet of title"": ""basic roman"", ""subject dewey"": ""500"", ""subject"": ""mathematics. natural sciences"", ""corporate contributor"": ""public library of science."", ""publisher"": ""san francisco ca: public library of science"", ""dates of publication"": ""2006- 9999"", ""description"": ""began with vol. 1(1) (2006)."", ""frequency"": ""monthly"", ""type of resource"": ""periodical"", ""language"": ""english"", ""country"": ""united states"", ""note"": [""vol. 1(1) (2006); title from journal home page (publisher's web site, viewed apr 8, 2008)."", ""4(6) (2009) (viewed june 12, 2009).""], ""medium"": ""online"", ""indexed by"": [""the keepers"", ""ezb"", ""openalex"", ""sherpa romeo"", ""sudoc"", ""wikidata"", ""wikipedia ar (arabic), wikipedia ca (catalan, valencian), wikipedia de (german), wikipedia en (english), wikipedia es (spanish, castilian), wikipedia fa (persian), wikipedia fi (finnish), wikipedia fr (french), wikipedia it (italian), wikipedia ja (japanese), wikipedia ko (korean), wikipedia nl (dutch,\u00a0flemish), wikipedia oc (occitan), wikipedia pl (polish), wikipedia pt (portuguese), wikipedia ru (russian), wikipedia sv (swedish), wikipedia th (thai), wikipedia uk (ukrainian), wikipedia vi (vietnamese), wikipedia zh (chinese), wikipedia eu (basque)"", ""fatcat"", ""zdb"", ""road"", ""pubmedcentral"", ""pubmed"", ""psychinfo"", ""mirabel"", ""medline"", ""web of science"", ""doaj"", ""crossref"", ""cirad (ou publier)"", ""georef""]}"
