abstract,authors,chemicals,citation,doi,history,issn,issue,journal,keywords,mesh,pmc,pmid,publication_types,title,url,volume,volume_issue,xml,year,author_first,references,institution,language,issn_data
"OBJECTIVES: Xpert MTB/RIF (Cepheid) assay has been introduced for the diagnosis of tuberculosis (TB) and RIF-resistance. The meta-analysis was used to establish the overall accuracy of Xpert MTB/RIF assay for diagnosing TB and RIF-resistance.
METHODS: Based on comprehensive searches of the Pubmed and Embase, we identified outcome data from all articles estimating diagnostic accuracy with Xpert MTB/RIF assay. A summary estimation for sensitivity, specificity, diagnostic odds ratios (DOR) and the area under the summary ROC curve (AUC) was calculated by using the bivariate random-effects approach.
RESULTS: The meta-analysis included 18 studies (10,224 suspected specimens). The summary estimate was 90.4% (95%CI 89.2%-91.4%) for sensitivity, 98.4% (95%CI 98.0%-98.7%) for specificity and 328.3/0.9822 for DOR/AUC in pulmonary tuberculosis (PTB). The sensitivity, specificity and DOR/AUC of detecting RIF-resistance were 94.1%, 97.0% and 177.8/0.9832, respectively. For extrapulmonary tuberculosis, the overall pooled sensitivity was 80.4% and specificity was 86.1%. The findings in subgroup analysis were as follows: the accuracy of Xpert MTB/RIF assay is higher in smear-positive specimens and the sensitivity of diagnosing PTB in adults was higher than that in children (90.8% versus 74.3%).
CONCLUSIONS: TB and RIF-resistance can be rapidly and effectively diagnosed with Xpert MTB/RIF assay.","['Chang K', 'Lu W', 'Wang J', 'Zhang K', 'Jia S', 'Li F', 'Deng S', 'Chen M']","{'D000995': {'substance_name': 'Antitubercular Agents', 'registry_number': '0'}, 'D012293': {'substance_name': 'Rifampin', 'registry_number': 'VJT6J7R4TR'}}","Chang K, et al. Rapid and effective diagnosis of tuberculosis and rifampicin resistance with Xpert MTB/RIF assay: a meta-analysis. Rapid and effective diagnosis of tuberculosis and rifampicin resistance with Xpert MTB/RIF assay: a meta-analysis. 2012; 64:580-8. doi: 10.1016/j.jinf.2012.02.012",10.1016/j.jinf.2012.02.012,"{'received': datetime.datetime(2011, 12, 21, 0, 0), 'revised': datetime.datetime(2012, 2, 13, 0, 0), 'accepted': datetime.datetime(2012, 2, 21, 0, 0), 'entrez': datetime.datetime(2012, 3, 3, 0, 0), 'pubmed': datetime.datetime(2012, 3, 3, 0, 0), 'medline': datetime.datetime(2012, 8, 31, 0, 0)}",1532-2742,6,J Infect,[],"{'D000328': {'descriptor_name': 'Adult', 'major_topic': False, 'qualifier_name': None, 'qualifier_ui': None}, 'D000995': {'descriptor_name': 'Antitubercular Agents', 'major_topic': False, 'qualifier_name': 'pharmacology', 'qualifier_ui': 'Q000494'}, 'D002648': {'descriptor_name': 'Child', 'major_topic': False, 'qualifier_name': None, 'qualifier_ui': None}, 'D002675': {'descriptor_name': 'Child, Preschool', 'major_topic': False, 'qualifier_name': None, 'qualifier_ui': None}, 'D024881': {'descriptor_name': 'Drug Resistance, Bacterial', 'major_topic': True, 'qualifier_name': None, 'qualifier_ui': None}, 'D006801': {'descriptor_name': 'Humans', 'major_topic': False, 'qualifier_name': None, 'qualifier_ui': None}, 'D025202': {'descriptor_name': 'Molecular Diagnostic Techniques', 'major_topic': True, 'qualifier_name': None, 'qualifier_ui': None}, 'D009169': {'descriptor_name': 'Mycobacterium tuberculosis', 'major_topic': False, 'qualifier_name': 'drug effects', 'qualifier_ui': 'Q000187'}, 'D011237': {'descriptor_name': 'Predictive Value of Tests', 'major_topic': False, 'qualifier_name': None, 'qualifier_ui': None}, 'D012372': {'descriptor_name': 'ROC Curve', 'major_topic': False, 'qualifier_name': None, 'qualifier_ui': None}, 'D012293': {'descriptor_name': 'Rifampin', 'major_topic': False, 'qualifier_name': 'pharmacology', 'qualifier_ui': 'Q000494'}, 'D012680': {'descriptor_name': 'Sensitivity and Specificity', 'major_topic': False, 'qualifier_name': None, 'qualifier_ui': None}, 'D018088': {'descriptor_name': 'Tuberculosis, Multidrug-Resistant', 'major_topic': False, 'qualifier_name': 'diagnosis', 'qualifier_ui': 'Q000175'}}",None,22381459,"{'D023362': 'Evaluation Study', 'D016428': 'Journal Article', 'D017418': 'Meta-Analysis', 'D013485': ""Research Support, Non-U.S. Gov't""}",Rapid and effective diagnosis of tuberculosis and rifampicin resistance with Xpert MTB/RIF assay: a meta-analysis.,https://ncbi.nlm.nih.gov/pubmed/22381459,64,64(6),"<?xml version=""1.0"" ?>
<!DOCTYPE PubmedArticleSet PUBLIC ""-//NLM//DTD PubMedArticle, 1st January 2025//EN"" ""https://dtd.nlm.nih.gov/ncbi/pubmed/out/pubmed_250101.dtd"">
<PubmedArticleSet>
<PubmedArticle><MedlineCitation Status=""MEDLINE"" Owner=""NLM"" IndexingMethod=""Manual""><PMID Version=""1"">22381459</PMID><DateCompleted><Year>2012</Year><Month>08</Month><Day>30</Day></DateCompleted><DateRevised><Year>2022</Year><Month>03</Month><Day>30</Day></DateRevised><Article PubModel=""Print-Electronic""><Journal><ISSN IssnType=""Electronic"">1532-2742</ISSN><JournalIssue CitedMedium=""Internet""><Volume>64</Volume><Issue>6</Issue><PubDate><Year>2012</Year><Month>Jun</Month></PubDate></JournalIssue><Title>The Journal of infection</Title><ISOAbbreviation>J Infect</ISOAbbreviation></Journal><ArticleTitle>Rapid and effective diagnosis of tuberculosis and rifampicin resistance with Xpert MTB/RIF assay: a meta-analysis.</ArticleTitle><Pagination><StartPage>580</StartPage><EndPage>588</EndPage><MedlinePgn>580-8</MedlinePgn></Pagination><ELocationID EIdType=""doi"" ValidYN=""Y"">10.1016/j.jinf.2012.02.012</ELocationID><Abstract><AbstractText Label=""OBJECTIVES"" NlmCategory=""OBJECTIVE"">Xpert MTB/RIF (Cepheid) assay has been introduced for the diagnosis of tuberculosis (TB) and RIF-resistance. The meta-analysis was used to establish the overall accuracy of Xpert MTB/RIF assay for diagnosing TB and RIF-resistance.</AbstractText><AbstractText Label=""METHODS"" NlmCategory=""METHODS"">Based on comprehensive searches of the Pubmed and Embase, we identified outcome data from all articles estimating diagnostic accuracy with Xpert MTB/RIF assay. A summary estimation for sensitivity, specificity, diagnostic odds ratios (DOR) and the area under the summary ROC curve (AUC) was calculated by using the bivariate random-effects approach.</AbstractText><AbstractText Label=""RESULTS"" NlmCategory=""RESULTS"">The meta-analysis included 18 studies (10,224 suspected specimens). The summary estimate was 90.4% (95%CI 89.2%-91.4%) for sensitivity, 98.4% (95%CI 98.0%-98.7%) for specificity and 328.3/0.9822 for DOR/AUC in pulmonary tuberculosis (PTB). The sensitivity, specificity and DOR/AUC of detecting RIF-resistance were 94.1%, 97.0% and 177.8/0.9832, respectively. For extrapulmonary tuberculosis, the overall pooled sensitivity was 80.4% and specificity was 86.1%. The findings in subgroup analysis were as follows: the accuracy of Xpert MTB/RIF assay is higher in smear-positive specimens and the sensitivity of diagnosing PTB in adults was higher than that in children (90.8% versus 74.3%).</AbstractText><AbstractText Label=""CONCLUSIONS"" NlmCategory=""CONCLUSIONS"">TB and RIF-resistance can be rapidly and effectively diagnosed with Xpert MTB/RIF assay.</AbstractText><CopyrightInformation>Copyright &#xa9; 2012 The British Infection Association. Published by Elsevier Ltd. All rights reserved.</CopyrightInformation></Abstract><AuthorList CompleteYN=""Y""><Author ValidYN=""Y""><LastName>Chang</LastName><ForeName>Kai</ForeName><Initials>K</Initials><AffiliationInfo><Affiliation>Department of Clinical Laboratory Medicine, Institute of Surgery Research, Daping Hospital, The Third Military Medical University, Chongqing, China.</Affiliation></AffiliationInfo></Author><Author ValidYN=""Y""><LastName>Lu</LastName><ForeName>Weiping</ForeName><Initials>W</Initials></Author><Author ValidYN=""Y""><LastName>Wang</LastName><ForeName>Junji</ForeName><Initials>J</Initials></Author><Author ValidYN=""Y""><LastName>Zhang</LastName><ForeName>Kejun</ForeName><Initials>K</Initials></Author><Author ValidYN=""Y""><LastName>Jia</LastName><ForeName>Shuangrong</ForeName><Initials>S</Initials></Author><Author ValidYN=""Y""><LastName>Li</LastName><ForeName>Fake</ForeName><Initials>F</Initials></Author><Author ValidYN=""Y""><LastName>Deng</LastName><ForeName>Shaoli</ForeName><Initials>S</Initials></Author><Author ValidYN=""Y""><LastName>Chen</LastName><ForeName>Ming</ForeName><Initials>M</Initials></Author></AuthorList><Language>eng</Language><PublicationTypeList><PublicationType UI=""D023362"">Evaluation Study</PublicationType><PublicationType UI=""D016428"">Journal Article</PublicationType><PublicationType UI=""D017418"">Meta-Analysis</PublicationType><PublicationType UI=""D013485"">Research Support, Non-U.S. Gov't</PublicationType></PublicationTypeList><ArticleDate DateType=""Electronic""><Year>2012</Year><Month>02</Month><Day>27</Day></ArticleDate></Article><MedlineJournalInfo><Country>England</Country><MedlineTA>J Infect</MedlineTA><NlmUniqueID>7908424</NlmUniqueID><ISSNLinking>0163-4453</ISSNLinking></MedlineJournalInfo><ChemicalList><Chemical><RegistryNumber>0</RegistryNumber><NameOfSubstance UI=""D000995"">Antitubercular Agents</NameOfSubstance></Chemical><Chemical><RegistryNumber>VJT6J7R4TR</RegistryNumber><NameOfSubstance UI=""D012293"">Rifampin</NameOfSubstance></Chemical></ChemicalList><CitationSubset>IM</CitationSubset><MeshHeadingList><MeshHeading><DescriptorName UI=""D000328"" MajorTopicYN=""N"">Adult</DescriptorName></MeshHeading><MeshHeading><DescriptorName UI=""D000995"" MajorTopicYN=""N"">Antitubercular Agents</DescriptorName><QualifierName UI=""Q000494"" MajorTopicYN=""Y"">pharmacology</QualifierName></MeshHeading><MeshHeading><DescriptorName UI=""D002648"" MajorTopicYN=""N"">Child</DescriptorName></MeshHeading><MeshHeading><DescriptorName UI=""D002675"" MajorTopicYN=""N"">Child, Preschool</DescriptorName></MeshHeading><MeshHeading><DescriptorName UI=""D024881"" MajorTopicYN=""Y"">Drug Resistance, Bacterial</DescriptorName></MeshHeading><MeshHeading><DescriptorName UI=""D006801"" MajorTopicYN=""N"">Humans</DescriptorName></MeshHeading><MeshHeading><DescriptorName UI=""D025202"" MajorTopicYN=""Y"">Molecular Diagnostic Techniques</DescriptorName></MeshHeading><MeshHeading><DescriptorName UI=""D009169"" MajorTopicYN=""N"">Mycobacterium tuberculosis</DescriptorName><QualifierName UI=""Q000187"" MajorTopicYN=""N"">drug effects</QualifierName><QualifierName UI=""Q000302"" MajorTopicYN=""Y"">isolation &amp; purification</QualifierName></MeshHeading><MeshHeading><DescriptorName UI=""D011237"" MajorTopicYN=""N"">Predictive Value of Tests</DescriptorName></MeshHeading><MeshHeading><DescriptorName UI=""D012372"" MajorTopicYN=""N"">ROC Curve</DescriptorName></MeshHeading><MeshHeading><DescriptorName UI=""D012293"" MajorTopicYN=""N"">Rifampin</DescriptorName><QualifierName UI=""Q000494"" MajorTopicYN=""Y"">pharmacology</QualifierName></MeshHeading><MeshHeading><DescriptorName UI=""D012680"" MajorTopicYN=""N"">Sensitivity and Specificity</DescriptorName></MeshHeading><MeshHeading><DescriptorName UI=""D018088"" MajorTopicYN=""N"">Tuberculosis, Multidrug-Resistant</DescriptorName><QualifierName UI=""Q000175"" MajorTopicYN=""Y"">diagnosis</QualifierName></MeshHeading></MeshHeadingList></MedlineCitation><PubmedData><History><PubMedPubDate PubStatus=""received""><Year>2011</Year><Month>12</Month><Day>21</Day></PubMedPubDate><PubMedPubDate PubStatus=""revised""><Year>2012</Year><Month>2</Month><Day>13</Day></PubMedPubDate><PubMedPubDate PubStatus=""accepted""><Year>2012</Year><Month>2</Month><Day>21</Day></PubMedPubDate><PubMedPubDate PubStatus=""entrez""><Year>2012</Year><Month>3</Month><Day>3</Day><Hour>6</Hour><Minute>0</Minute></PubMedPubDate><PubMedPubDate PubStatus=""pubmed""><Year>2012</Year><Month>3</Month><Day>3</Day><Hour>6</Hour><Minute>0</Minute></PubMedPubDate><PubMedPubDate PubStatus=""medline""><Year>2012</Year><Month>8</Month><Day>31</Day><Hour>6</Hour><Minute>0</Minute></PubMedPubDate></History><PublicationStatus>ppublish</PublicationStatus><ArticleIdList><ArticleId IdType=""pubmed"">22381459</ArticleId><ArticleId IdType=""doi"">10.1016/j.jinf.2012.02.012</ArticleId><ArticleId IdType=""pii"">S0163-4453(12)00042-4</ArticleId></ArticleIdList></PubmedData></PubmedArticle></PubmedArticleSet>",2012,Chang K,[],"Department of Clinical Laboratory Medicine, Institute of Surgery Research, Daping Hospital, The Third Military Medical University, Chongqing, China.",English,"{""title proper"": ""journal of infection"", ""country"": ""united kingdom"", ""medium"": ""online""}"
"The detection of Mycobacterium tuberculosis using a new commercial real-time polymerase chain reaction (PCR) assay (Xpert™ MTB/RIF) was evaluated on 91 respiratory and 89 non-respiratory samples recovered from 132 patients suspected of tuberculosis (TB). Overall, 31 (17.2%) of the 180 samples, including 17 respiratory and 14 non-respiratory (respectively 17 and 12 PCR-positive), yielded M. tuberculosis on culture. The sensitivity and specificity of PCR were respectively 100% and 100%, and 85.7% and 97.3% for respiratory and non-respiratory samples. Although the test is validated only for respiratory samples, our findings suggest that it could be useful for the diagnosis of extra-pulmonary TB.","['Malbruny B', 'Le Marrec G', 'Courageux K', 'Leclercq R', 'Cattoir V']",{},"Malbruny B, et al. Rapid and efficient detection of Mycobacterium tuberculosis in respiratory and non-respiratory samples. Rapid and efficient detection of Mycobacterium tuberculosis in respiratory and non-respiratory samples. 2011; 15:553-5. doi: 10.5588/ijtld.10.0497",10.5588/ijtld.10.0497,"{'entrez': datetime.datetime(2011, 3, 15, 0, 0), 'pubmed': datetime.datetime(2011, 3, 15, 0, 0), 'medline': datetime.datetime(2011, 6, 30, 0, 0)}",1815-7920,4,Int J Tuberc Lung Dis,[],"{'D005260': {'descriptor_name': 'Female', 'major_topic': False, 'qualifier_name': None, 'qualifier_ui': None}, 'D006801': {'descriptor_name': 'Humans', 'major_topic': False, 'qualifier_name': None, 'qualifier_ui': None}, 'D008297': {'descriptor_name': 'Male', 'major_topic': False, 'qualifier_name': None, 'qualifier_ui': None}, 'D008875': {'descriptor_name': 'Middle Aged', 'major_topic': False, 'qualifier_name': None, 'qualifier_ui': None}, 'D009169': {'descriptor_name': 'Mycobacterium tuberculosis', 'major_topic': False, 'qualifier_name': 'isolation & purification', 'qualifier_ui': 'Q000302'}, 'D016133': {'descriptor_name': 'Polymerase Chain Reaction', 'major_topic': False, 'qualifier_name': 'methods', 'qualifier_ui': 'Q000379'}, 'D011446': {'descriptor_name': 'Prospective Studies', 'major_topic': False, 'qualifier_name': None, 'qualifier_ui': None}, 'D012680': {'descriptor_name': 'Sensitivity and Specificity', 'major_topic': False, 'qualifier_name': None, 'qualifier_ui': None}, 'D014376': {'descriptor_name': 'Tuberculosis', 'major_topic': False, 'qualifier_name': 'diagnosis', 'qualifier_ui': 'Q000175'}}",None,21396219,"{'D016428': 'Journal Article', 'D023361': 'Validation Study'}",Rapid and efficient detection of Mycobacterium tuberculosis in respiratory and non-respiratory samples.,https://ncbi.nlm.nih.gov/pubmed/21396219,15,15(4),"<?xml version=""1.0"" ?>
<!DOCTYPE PubmedArticleSet PUBLIC ""-//NLM//DTD PubMedArticle, 1st January 2025//EN"" ""https://dtd.nlm.nih.gov/ncbi/pubmed/out/pubmed_250101.dtd"">
<PubmedArticleSet>
<PubmedArticle><MedlineCitation Status=""MEDLINE"" Owner=""NLM"" IndexingMethod=""Manual""><PMID Version=""1"">21396219</PMID><DateCompleted><Year>2011</Year><Month>06</Month><Day>29</Day></DateCompleted><DateRevised><Year>2022</Year><Month>04</Month><Day>08</Day></DateRevised><Article PubModel=""Print""><Journal><ISSN IssnType=""Electronic"">1815-7920</ISSN><JournalIssue CitedMedium=""Internet""><Volume>15</Volume><Issue>4</Issue><PubDate><Year>2011</Year><Month>Apr</Month></PubDate></JournalIssue><Title>The international journal of tuberculosis and lung disease : the official journal of the International Union against Tuberculosis and Lung Disease</Title><ISOAbbreviation>Int J Tuberc Lung Dis</ISOAbbreviation></Journal><ArticleTitle>Rapid and efficient detection of Mycobacterium tuberculosis in respiratory and non-respiratory samples.</ArticleTitle><Pagination><StartPage>553</StartPage><EndPage>555</EndPage><MedlinePgn>553-5</MedlinePgn></Pagination><ELocationID EIdType=""doi"" ValidYN=""Y"">10.5588/ijtld.10.0497</ELocationID><Abstract><AbstractText>The detection of Mycobacterium tuberculosis using a new commercial real-time polymerase chain reaction (PCR) assay (Xpert&#x2122; MTB/RIF) was evaluated on 91 respiratory and 89 non-respiratory samples recovered from 132 patients suspected of tuberculosis (TB). Overall, 31 (17.2%) of the 180 samples, including 17 respiratory and 14 non-respiratory (respectively 17 and 12 PCR-positive), yielded M. tuberculosis on culture. The sensitivity and specificity of PCR were respectively 100% and 100%, and 85.7% and 97.3% for respiratory and non-respiratory samples. Although the test is validated only for respiratory samples, our findings suggest that it could be useful for the diagnosis of extra-pulmonary TB.</AbstractText></Abstract><AuthorList CompleteYN=""Y""><Author ValidYN=""Y""><LastName>Malbruny</LastName><ForeName>B</ForeName><Initials>B</Initials><AffiliationInfo><Affiliation>Service de Microbiologie, Centre Hospitali&#xe8;re Universitaire C&#xf4;te de Nacre, Caen, France.</Affiliation></AffiliationInfo></Author><Author ValidYN=""Y""><LastName>Le Marrec</LastName><ForeName>G</ForeName><Initials>G</Initials></Author><Author ValidYN=""Y""><LastName>Courageux</LastName><ForeName>K</ForeName><Initials>K</Initials></Author><Author ValidYN=""Y""><LastName>Leclercq</LastName><ForeName>R</ForeName><Initials>R</Initials></Author><Author ValidYN=""Y""><LastName>Cattoir</LastName><ForeName>V</ForeName><Initials>V</Initials></Author></AuthorList><Language>eng</Language><PublicationTypeList><PublicationType UI=""D016428"">Journal Article</PublicationType><PublicationType UI=""D023361"">Validation Study</PublicationType></PublicationTypeList></Article><MedlineJournalInfo><Country>France</Country><MedlineTA>Int J Tuberc Lung Dis</MedlineTA><NlmUniqueID>9706389</NlmUniqueID><ISSNLinking>1027-3719</ISSNLinking></MedlineJournalInfo><CitationSubset>IM</CitationSubset><MeshHeadingList><MeshHeading><DescriptorName UI=""D005260"" MajorTopicYN=""N"">Female</DescriptorName></MeshHeading><MeshHeading><DescriptorName UI=""D006801"" MajorTopicYN=""N"">Humans</DescriptorName></MeshHeading><MeshHeading><DescriptorName UI=""D008297"" MajorTopicYN=""N"">Male</DescriptorName></MeshHeading><MeshHeading><DescriptorName UI=""D008875"" MajorTopicYN=""N"">Middle Aged</DescriptorName></MeshHeading><MeshHeading><DescriptorName UI=""D009169"" MajorTopicYN=""N"">Mycobacterium tuberculosis</DescriptorName><QualifierName UI=""Q000302"" MajorTopicYN=""Y"">isolation &amp; purification</QualifierName></MeshHeading><MeshHeading><DescriptorName UI=""D016133"" MajorTopicYN=""N"">Polymerase Chain Reaction</DescriptorName><QualifierName UI=""Q000379"" MajorTopicYN=""Y"">methods</QualifierName></MeshHeading><MeshHeading><DescriptorName UI=""D011446"" MajorTopicYN=""N"">Prospective Studies</DescriptorName></MeshHeading><MeshHeading><DescriptorName UI=""D012680"" MajorTopicYN=""N"">Sensitivity and Specificity</DescriptorName></MeshHeading><MeshHeading><DescriptorName UI=""D014376"" MajorTopicYN=""N"">Tuberculosis</DescriptorName><QualifierName UI=""Q000175"" MajorTopicYN=""Y"">diagnosis</QualifierName><QualifierName UI=""Q000382"" MajorTopicYN=""N"">microbiology</QualifierName></MeshHeading></MeshHeadingList></MedlineCitation><PubmedData><History><PubMedPubDate PubStatus=""entrez""><Year>2011</Year><Month>3</Month><Day>15</Day><Hour>6</Hour><Minute>0</Minute></PubMedPubDate><PubMedPubDate PubStatus=""pubmed""><Year>2011</Year><Month>3</Month><Day>15</Day><Hour>6</Hour><Minute>0</Minute></PubMedPubDate><PubMedPubDate PubStatus=""medline""><Year>2011</Year><Month>6</Month><Day>30</Day><Hour>6</Hour><Minute>0</Minute></PubMedPubDate></History><PublicationStatus>ppublish</PublicationStatus><ArticleIdList><ArticleId IdType=""pubmed"">21396219</ArticleId><ArticleId IdType=""doi"">10.5588/ijtld.10.0497</ArticleId></ArticleIdList></PubmedData></PubmedArticle></PubmedArticleSet>",2011,Malbruny B,[],"Service de Microbiologie, Centre Hospitalière Universitaire Côte de Nacre, Caen, France.",English,"{""title proper"": ""the international journal of tuberculosis and lung disease."", ""country"": ""international"", ""medium"": ""online""}"
